{
  "schemaVersion": "1.0.0",
  "profileId": "asobo-c400-corvalis",
  "profileKey": "asobo/c400-corvalis",
  "semver": "1.0.0",
  "displayName": "C400 Corvalis (draft)",
  "match": {
    "fingerprint": "ef69c1fdd7b1f07155c156ccab8393c47b8eb707cf0d78ce03d138fe144b859d",
    "title": "C400 Corvalis",
    "publisher": "asobo",
    "icao": "C400TT"
  },
  "capabilities": [
    "simconnect"
  ],
  "gating": {
    "requireOnGround": true,
    "requireEnginesOff": false,
    "blockWhenPaused": true,
    "blockWhenSlew": true,
    "minSimRate": 0.9,
    "maxSimRate": 1.1
  },
  "fuel": {
    "strategy": "simconnect-direct",
    "unit": "gallons",
    "tanks": [
      {
        "id": "LEFT_MAIN",
        "name": "FUELSYSTEM:1",
        "capacity": 53,
        "readVar": "FUELSYSTEM TANK QUANTITY:1",
        "readUnit": "gallons",
        "writeVar": "FUELSYSTEM TANK QUANTITY:1",
        "writeUnit": "gallons"
      },
      {
        "id": "RIGHT_MAIN",
        "name": "FUELSYSTEM:2",
        "capacity": 53,
        "readVar": "FUELSYSTEM TANK QUANTITY:2",
        "readUnit": "gallons",
        "writeVar": "FUELSYSTEM TANK QUANTITY:2",
        "writeUnit": "gallons"
      }
    ],
    "writePlan": [
      {
        "op": "simvar_set",
        "var": "FUELSYSTEM TANK QUANTITY:1",
        "unit": "gallons",
        "valueExpr": "{LEFT_MAIN} + 2"
      },
      {
        "op": "simvar_set",
        "var": "FUELSYSTEM TANK QUANTITY:2",
        "unit": "gallons",
        "valueExpr": "{RIGHT_MAIN} + 2"
      },
      {
        "op": "delay",
        "ms": 400
      }
    ],
    "verify": {
      "timeoutMs": 6000,
      "pollIntervalMs": 250,
      "checks": [
        {
          "var": "FUELSYSTEM TANK QUANTITY:1",
          "unit": "gallons",
          "tolerancePct": 2,
          "valueExpr": "{LEFT_MAIN}"
        },
        {
          "var": "FUELSYSTEM TANK QUANTITY:2",
          "unit": "gallons",
          "tolerancePct": 2,
          "valueExpr": "{RIGHT_MAIN}"
        }
      ]
    }
  },
  "payload": {
    "strategy": "station-writeback",
    "stations": [
      {
        "index": 1,
        "name": "Station 1",
        "maxLoad": 500
      },
      {
        "index": 2,
        "name": "Station 2",
        "maxLoad": 500
      },
      {
        "index": 3,
        "name": "Station 3",
        "maxLoad": 500
      },
      {
        "index": 4,
        "name": "Station 4",
        "maxLoad": 500
      },
      {
        "index": 5,
        "name": "Station 5",
        "maxLoad": 500
      }
    ],
    "writePlan": [
      {
        "op": "simvar_set",
        "var": "PAYLOAD STATION WEIGHT:1",
        "unit": "pounds",
        "valueExpr": "{station_1}"
      },
      {
        "op": "simvar_set",
        "var": "PAYLOAD STATION WEIGHT:2",
        "unit": "pounds",
        "valueExpr": "{station_2}"
      },
      {
        "op": "simvar_set",
        "var": "PAYLOAD STATION WEIGHT:3",
        "unit": "pounds",
        "valueExpr": "{station_3}"
      },
      {
        "op": "simvar_set",
        "var": "PAYLOAD STATION WEIGHT:4",
        "unit": "pounds",
        "valueExpr": "{station_4}"
      },
      {
        "op": "simvar_set",
        "var": "PAYLOAD STATION WEIGHT:5",
        "unit": "pounds",
        "valueExpr": "{station_5}"
      },
      {
        "op": "delay",
        "ms": 400
      }
    ],
    "verify": {
      "timeoutMs": 6000,
      "pollIntervalMs": 250,
      "checks": [
        {
          "var": "PAYLOAD STATION WEIGHT:1",
          "unit": "pounds",
          "tolerancePct": 1,
          "valueExpr": "{station_1}"
        }
      ]
    }
  },
  "cg": {
    "readVar": "CG PERCENT",
    "readUnit": "Percent over 100",
    "constraints": {
      "minMac": 6,
      "maxMac": 42
    }
  },
  "fallback": {
    "chain": [
      "simconnect-direct"
    ]
  },
  "notes": [
    "AUTO-CALIBRATED fuelOffset=2 (median of 2 tank probe(s)).",
    "verify.tolerancePct=2; cg envelope 6-42% (live CG≈21.6).",
    "Re-run smoke to confirm; then promote to profiles/examples.",
    "Move to profiles/examples after smoke succeeds; bump semver and remove -draft.",
    "Detected tanks=2, stations=5, fuelOffset=0"
  ]
}
