{
  "schemaVersion": "1.0.0",
  "profileId": "blacksquare-b60-duke",
  "profileKey": "blacksquare/b60-duke",
  "semver": "1.0.0",
  "displayName": "Black Square B60 Duke (MSFS 2024)",
  "match": {
    "fingerprint": "c062903eaabf0257929da435d5bf55f3de3bce61f1fae5c4d367f7e97b49ba1c",
    "title": "Black Square B60 Duke",
    "publisher": "blacksquare",
    "icao": "BE60"
  },
  "capabilities": [
    "simconnect"
  ],
  "gating": {
    "requireOnGround": true,
    "requireEnginesOff": false,
    "blockWhenPaused": true,
    "blockWhenSlew": true,
    "minSimRate": 0.9,
    "maxSimRate": 1.1
  },
  "fuel": {
    "strategy": "simconnect-direct",
    "unit": "gallons",
    "tanks": [
      {
        "id": "LEFT_MAIN",
        "name": "Left Main",
        "capacity": 103.5,
        "readVar": "FUEL TANK LEFT MAIN QUANTITY",
        "readUnit": "gallons",
        "writeVar": "FUEL TANK LEFT MAIN QUANTITY",
        "writeUnit": "gallons"
      },
      {
        "id": "RIGHT_MAIN",
        "name": "Right Main",
        "capacity": 103.5,
        "readVar": "FUEL TANK RIGHT MAIN QUANTITY",
        "readUnit": "gallons",
        "writeVar": "FUEL TANK RIGHT MAIN QUANTITY",
        "writeUnit": "gallons"
      }
    ],
    "writePlan": [
      {
        "op": "simvar_set",
        "var": "FUEL TANK LEFT MAIN QUANTITY",
        "unit": "gallons",
        "valueExpr": "{LEFT_MAIN}"
      },
      {
        "op": "simvar_set",
        "var": "FUEL TANK RIGHT MAIN QUANTITY",
        "unit": "gallons",
        "valueExpr": "{RIGHT_MAIN}"
      },
      {
        "op": "delay",
        "ms": 400
      }
    ],
    "verify": {
      "timeoutMs": 6000,
      "pollIntervalMs": 250,
      "checks": [
        {
          "var": "FUEL TANK LEFT MAIN QUANTITY",
          "unit": "gallons",
          "tolerancePct": 2,
          "valueExpr": "{LEFT_MAIN}"
        },
        {
          "var": "FUEL TANK RIGHT MAIN QUANTITY",
          "unit": "gallons",
          "tolerancePct": 2,
          "valueExpr": "{RIGHT_MAIN}"
        }
      ]
    }
  },
  "payload": {
    "strategy": "station-writeback",
    "stations": [
      {
        "index": 1,
        "name": "Station 1",
        "maxLoad": 500
      },
      {
        "index": 2,
        "name": "Station 2",
        "maxLoad": 500
      },
      {
        "index": 3,
        "name": "Station 3",
        "maxLoad": 500
      },
      {
        "index": 4,
        "name": "Station 4",
        "maxLoad": 500
      },
      {
        "index": 5,
        "name": "Station 5",
        "maxLoad": 500
      },
      {
        "index": 6,
        "name": "Station 6",
        "maxLoad": 500
      },
      {
        "index": 7,
        "name": "Station 7",
        "maxLoad": 500
      },
      {
        "index": 8,
        "name": "Station 8",
        "maxLoad": 500
      }
    ],
    "writePlan": [
      {
        "op": "simvar_set",
        "var": "PAYLOAD STATION WEIGHT:1",
        "unit": "pounds",
        "valueExpr": "{station_1}"
      },
      {
        "op": "simvar_set",
        "var": "PAYLOAD STATION WEIGHT:2",
        "unit": "pounds",
        "valueExpr": "{station_2}"
      },
      {
        "op": "simvar_set",
        "var": "PAYLOAD STATION WEIGHT:3",
        "unit": "pounds",
        "valueExpr": "{station_3}"
      },
      {
        "op": "simvar_set",
        "var": "PAYLOAD STATION WEIGHT:4",
        "unit": "pounds",
        "valueExpr": "{station_4}"
      },
      {
        "op": "simvar_set",
        "var": "PAYLOAD STATION WEIGHT:5",
        "unit": "pounds",
        "valueExpr": "{station_5}"
      },
      {
        "op": "simvar_set",
        "var": "PAYLOAD STATION WEIGHT:6",
        "unit": "pounds",
        "valueExpr": "{station_6}"
      },
      {
        "op": "simvar_set",
        "var": "PAYLOAD STATION WEIGHT:7",
        "unit": "pounds",
        "valueExpr": "{station_7}"
      },
      {
        "op": "simvar_set",
        "var": "PAYLOAD STATION WEIGHT:8",
        "unit": "pounds",
        "valueExpr": "{station_8}"
      },
      {
        "op": "delay",
        "ms": 400
      }
    ],
    "verify": {
      "timeoutMs": 6000,
      "pollIntervalMs": 250,
      "checks": [
        {
          "var": "PAYLOAD STATION WEIGHT:1",
          "unit": "pounds",
          "tolerancePct": 1,
          "valueExpr": "{station_1}"
        }
      ]
    }
  },
  "cg": {
    "readVar": "CG PERCENT",
    "readUnit": "Percent over 100",
    "constraints": {
      "minMac": 10,
      "maxMac": 46
    }
  },
  "fallback": {
    "chain": [
      "simconnect-direct"
    ]
  },
  "notes": [
    "Homologated via wizard: Black Square B60 Duke.",
    "Fuel via classic FUEL TANK * (offset 0). Do not use FUELSYSTEM.",
    "AUX deferred for v1.",
    "Stations: 8.",
    "Homologated with interactive wizard.",
    "See profiles/notes/blacksquare-b60-duke.md"
  ]
}
